{
  "artifact_bindings": {
    "composite_foundation_adapter": {
      "declared_hash": "6656bbf9c9129bfe19120e2a2655d979890e87e457dd722280ea1c5d85e75864",
      "hash_reproducible": true,
      "name": "composite_foundation_adapter",
      "present": true,
      "status": "ready",
      "target_level": "RDLLM-L125",
      "version": "rdllm-composite-foundation-adapter/v1"
    },
    "discovery_manifest": {
      "declared_hash": "ef30383461749d41f25c23439b7fa299dd10e267eeed8cd3978fe438bc911600",
      "hash_reproducible": true,
      "name": "discovery_manifest",
      "present": true,
      "status": "ready",
      "target_level": "RDLLM-L131",
      "version": "rdllm-discovery-manifest/v1"
    },
    "foundation_model_deployment_attestation": {
      "declared_hash": "98d71bb8ee99504b9f000419d66d7e7326dc2a4d849f8eddf9837fe17b343ef0",
      "hash_reproducible": true,
      "name": "foundation_model_deployment_attestation",
      "present": true,
      "status": "released",
      "target_level": "RDLLM-L129",
      "version": "rdllm-foundation-model-deployment-attestation/v1"
    },
    "foundation_provider_conformance": {
      "declared_hash": "db1fdda0749269946a8f5b65b2c86bcd42c54250e3c8a919a984f3558a2fad2f",
      "hash_reproducible": true,
      "name": "foundation_provider_conformance",
      "present": true,
      "status": "ready",
      "target_level": "RDLLM-L126",
      "version": "rdllm-foundation-provider-conformance/v1"
    },
    "foundation_runtime_adapter": {
      "declared_hash": "137937a37b62c8a562fe89b4617377e02396557159d16324bb076cab94a75c51",
      "hash_reproducible": true,
      "name": "foundation_runtime_adapter",
      "present": true,
      "status": "released",
      "target_level": "RDLLM-L127",
      "version": "rdllm-foundation-runtime-adapter/v1"
    },
    "foundation_runtime_router": {
      "declared_hash": "60e336943123017eceea9e444c7b529cd7ff044ce2b6d8024217b0b6bbb62a27",
      "hash_reproducible": true,
      "name": "foundation_runtime_router",
      "present": true,
      "status": "released",
      "target_level": "RDLLM-L128",
      "version": "rdllm-foundation-runtime-router/v1"
    },
    "integration_profile": {
      "declared_hash": "ce0c5fe1085f700dc54137f30861d1b5319e322b9a2d027c7902afbc4822cb98",
      "hash_reproducible": true,
      "name": "integration_profile",
      "present": true,
      "status": "ready",
      "target_level": "",
      "version": "rdllm-integration-profile/v1"
    },
    "proof_dependency_graph": {
      "declared_hash": "6d997fcf641cae8a251d42f0d4641ee74eba20fd72bb390b7d07d6c9290fa745",
      "hash_reproducible": true,
      "name": "proof_dependency_graph",
      "present": true,
      "status": "ready",
      "target_level": "RDLLM-L131",
      "version": "rdllm-proof-dependency-graph/v1"
    },
    "provider_attribution_card": {
      "declared_hash": "0398c33b05576334b856a44b3089a1093bcf0c4ada39656cb40fb504810eeba6",
      "hash_reproducible": true,
      "name": "provider_attribution_card",
      "present": true,
      "status": "",
      "target_level": "",
      "version": "rdllm-provider-attribution-card/v1"
    },
    "universal_composition_receipt": {
      "declared_hash": "1a7f07d1b8ed7aa665531a4678f15e4ffe69a0d8f8f472bb459d361b3af46f07",
      "hash_reproducible": true,
      "name": "universal_composition_receipt",
      "present": true,
      "status": "released",
      "target_level": "RDLLM-L130",
      "version": "rdllm-universal-composition-receipt/v1"
    },
    "universal_composition_settlement": {
      "declared_hash": "891ec7d627a812a0b26fea27e2a4fe68759aee39251b7660fd3a92334c29002a",
      "hash_reproducible": true,
      "name": "universal_composition_settlement",
      "present": true,
      "status": "ready",
      "target_level": "RDLLM-L131",
      "version": "rdllm-universal-composition-settlement/v1"
    }
  },
  "checks": {
    "artifact_hashes_reproducible": true,
    "composite_adapter_ready_l125": true,
    "creator_pool_conserved": true,
    "discovery_profile_and_graph_publish_contract": true,
    "fail_closed_router_policy": true,
    "private_text_not_disclosed": true,
    "provider_conformance_ready_l126": true,
    "provider_families_cover_required_set": true,
    "required_artifacts_present": true,
    "required_public_surfaces_published": true,
    "router_covers_all_provider_families": true,
    "runtime_router_released_l128": true,
    "selected_route_binds_runtime_and_deployment": true,
    "source_footer_to_settlement_bound": true,
    "universal_composition_released_l130": true,
    "universal_composition_settlement_ready_l131": true
  },
  "commitments": {
    "artifact_binding_root": "ee6ee1e0068711bd8697092cf4808c859be1f84178c879bdc2d2d90be6da9d47",
    "l131_settlement_hash": "891ec7d627a812a0b26fea27e2a4fe68759aee39251b7660fd3a92334c29002a",
    "provider_family_root": "c4027f95dc97a50d61b8df66068d61efe89443180b06d50dfce1753a5e1a1e4b",
    "public_surface_binding_hash": "6a964cede25b5898eca8c6f16a8b96278c5419684243cca5c83f9b559f9207c4",
    "selected_route_binding_hash": "2852c159d266dbf64505b2940d6a07835c680236a9029c966a74484541c089a0"
  },
  "contract_decision": {
    "decision": "release_universal_contract",
    "failed_checks": [],
    "failure_modes": [],
    "release_authorized": true,
    "safe_output_policy": "emit_only_l132_universal_rdllm_contract"
  },
  "contract_policy": {
    "minimum_discovery_level": "RDLLM-L131",
    "minimum_input_level": "RDLLM-L131",
    "minimum_proof_graph_level": "RDLLM-L131",
    "on_missing_provider_family": "block_model_release",
    "on_missing_public_surface": "block_model_release",
    "on_private_text_leak": "block_publication",
    "on_unreleased_runtime_chain": "block_model_release",
    "on_unsettled_composition": "block_model_release",
    "profile": "rdllm-universal-foundation-model-contract-policy/v1",
    "required_chain_artifacts": [
      "provider_attribution_card",
      "integration_profile",
      "discovery_manifest",
      "proof_dependency_graph",
      "composite_foundation_adapter",
      "foundation_provider_conformance",
      "foundation_runtime_adapter",
      "foundation_runtime_router",
      "foundation_model_deployment_attestation",
      "universal_composition_receipt",
      "universal_composition_settlement"
    ],
    "required_provider_families": [
      "openai_responses",
      "anthropic_messages",
      "google_gemini",
      "meta_llama",
      "mistral_chat",
      "cohere_chat",
      "xai_grok",
      "amazon_bedrock_converse",
      "azure_openai_responses",
      "openai_compatible_chat"
    ],
    "required_public_surfaces": [
      "composite_foundation_adapter",
      "foundation_provider_conformance",
      "foundation_runtime_adapter",
      "foundation_runtime_router",
      "foundation_model_deployment_attestation",
      "universal_composition_receipt",
      "universal_composition_settlement"
    ],
    "target_certification_level": "RDLLM-L132"
  },
  "contract_version": "rdllm-universal-foundation-model-contract/v1",
  "coverage_gaps": {
    "failed_checks": [],
    "missing_discovery_surfaces": [],
    "missing_integration_surfaces": [],
    "missing_provider_families": []
  },
  "created_at": "2026-06-01T20:47:30Z",
  "issuer": "rdllm-local-demo",
  "privacy": {
    "hash_only_provider_fixtures": true,
    "private_strings_absent": true,
    "private_text_fields_excluded": true,
    "raw_prompts_outputs_sources_excluded": true
  },
  "provider_family_rows": [
    {
      "capability_count": 9,
      "covered_by_adapter": true,
      "covered_by_conformance": true,
      "covered_by_router": true,
      "fail_closed_backed": true,
      "foundation_provider_conformance_row_hash": "63c05cb630f511eb1a809b0de31b6d6012bd95c714205c2e77efd2a6385e1e19",
      "native_api_version": "converse/v1",
      "native_model": "aws:bedrock-converse-compatible",
      "negative_fixture_count": 6,
      "official_documentation_refs": [
        "https://docs.aws.amazon.com/bedrock/latest/userguide/conversation-inference.html"
      ],
      "provider_adapter_row_hash": "a9c903c9a42fe560e35e78d5378a8a781b5580fefa886c0847f242c85d2e2db5",
      "provider_family": "amazon_bedrock_converse",
      "provider_id": "provider:amazon-bedrock-converse",
      "route_hash": "1f66ede4a0bce79e97fa9cd391fa7ff7582d843f087dfed4ebf168345bc4067d",
      "route_id": "route:amazon_bedrock_converse",
      "universal_provider_contract_row_hash": "6c58d50b073dde3609a952f9231a4d6b3b57e5dd1139e0b0565281f917666b4b"
    },
    {
      "capability_count": 9,
      "covered_by_adapter": true,
      "covered_by_conformance": true,
      "covered_by_router": true,
      "fail_closed_backed": true,
      "foundation_provider_conformance_row_hash": "3feee62d5008d7a867f77aa5965d88cd89e716d4aca00539a136af113dcdae93",
      "native_api_version": "messages/v1",
      "native_model": "anthropic:messages-compatible",
      "negative_fixture_count": 6,
      "official_documentation_refs": [
        "https://docs.anthropic.com/en/api/messages"
      ],
      "provider_adapter_row_hash": "caebd2c7215d84c40b79f767c5aff42c95f2e90d99d511d6f9edc779a858b1a7",
      "provider_family": "anthropic_messages",
      "provider_id": "provider:anthropic-messages",
      "route_hash": "cd1bfa0defc793cfc0fd03a69b42c2b5162888445bc851f833aad9139ecbe561",
      "route_id": "route:anthropic_messages",
      "universal_provider_contract_row_hash": "c7398a3a971308c8e62190c0b82b2a5f2af1ec4c12353e7517b70ef9900c388d"
    },
    {
      "capability_count": 9,
      "covered_by_adapter": true,
      "covered_by_conformance": true,
      "covered_by_router": true,
      "fail_closed_backed": true,
      "foundation_provider_conformance_row_hash": "869266d6dc51b146c98f442242b4225e745c263f31ba786b3dd4e19cfaaa9d36",
      "native_api_version": "responses/v1",
      "native_model": "azure-openai:responses-compatible",
      "negative_fixture_count": 6,